{
  "architecture_class": "dense_decoder",
  "blocked_roles": [],
  "complete": true,
  "measurement_phase_count": 5,
  "model_id": "Qwen3-8B",
  "next_artifact": "measurement_plan.json",
  "quant_gemv_regimes": [
    {
      "classification": "streaming_bound",
      "kind": "quant_gemv",
      "marlin_viability": {
        "dequant_hidden": true,
        "metadata_hidden": true,
        "offline_layout_useful": false,
        "packed_load_width_sufficient": true,
        "partitioning_overhead_acceptable": null,
        "pipeline_depth_sufficient": true
      },
      "metrics": {
        "achieved_gbs": 85.4,
        "activation_bytes": 80.0,
        "active_waves": 128.0,
        "available_concurrency_bytes": 131072.0,
        "barrier_count": null,
        "baseline_us": null,
        "bitunpack_instruction_count": 0.0,
        "candidate_us": 100.0,
        "compute_util_pct": 20.0,
        "concurrency_ratio": 4.859918427882833,
        "convert_instruction_count": 0.0,
        "dequant_instruction_count": 0.0,
        "dequant_instruction_fraction": 0.0,
        "dequant_us": null,
        "dot_instruction_count": 1000.0,
        "in_flight_groups": 64.0,
        "lds_bytes": 0.0,
        "memory_latency_ns": 300.0,
        "metadata_byte_fraction": 0.02,
        "metadata_bytes": 20.0,
        "metadata_instruction_count": 0.0,
        "metadata_instruction_fraction": 0.0,
        "metadata_us": null,
        "occupancy_pct": 80.0,
        "pct_of_target_gbs": 94.99443826473859,
        "physical_weight_bytes": 900.0,
        "reduction_us": null,
        "registers": 64.0,
        "required_concurrency_bytes": 26970.0,
        "scratch_bytes": 0.0,
        "spread_pct": 1.5,
        "target_gbs": 89.9,
        "target_vector_load_bits": 128,
        "vector_load_bits": 128.0,
        "waitcnt_count": null,
        "weight_byte_fraction": 0.9
      },
      "missing_fields": [],
      "next_action": "preserve wide coalesced packed loads; only compression or layout that keeps load-bound behavior can help",
      "probe_id": "quant_gemv:ffn_gate_up:Q4_K:12288x4096:n72:e0",
      "quant": "Q4_K",
      "reasons": [
        "physical weight bytes dominate and auxiliary work is not visible"
      ],
      "role": "ffn_gate_up",
      "shape": [
        12288,
        4096
      ],
      "visible_bottleneck": "weight_load"
    },
    {
      "classification": "occupancy_starved",
      "kind": "quant_gemv",
      "marlin_viability": {
        "dequant_hidden": true,
        "metadata_hidden": true,
        "offline_layout_useful": false,
        "packed_load_width_sufficient": true,
        "partitioning_overhead_acceptable": null,
        "pipeline_depth_sufficient": false
      },
      "metrics": {
        "achieved_gbs": 60.0,
        "activation_bytes": 80.0,
        "active_waves": 128.0,
        "available_concurrency_bytes": 24576.0,
        "barrier_count": null,
        "baseline_us": null,
        "bitunpack_instruction_count": 0.0,
        "candidate_us": 100.0,
        "compute_util_pct": 20.0,
        "concurrency_ratio": 0.9112347052280312,
        "convert_instruction_count": 0.0,
        "dequant_instruction_count": 0.0,
        "dequant_instruction_fraction": 0.0,
        "dequant_us": null,
        "dot_instruction_count": 1000.0,
        "in_flight_groups": 12.0,
        "lds_bytes": 0.0,
        "memory_latency_ns": 300.0,
        "metadata_byte_fraction": 0.02,
        "metadata_bytes": 20.0,
        "metadata_instruction_count": 0.0,
        "metadata_instruction_fraction": 0.0,
        "metadata_us": null,
        "occupancy_pct": 35.0,
        "pct_of_target_gbs": 66.74082313681868,
        "physical_weight_bytes": 900.0,
        "reduction_us": null,
        "registers": 64.0,
        "required_concurrency_bytes": 26970.0,
        "scratch_bytes": 0.0,
        "spread_pct": 1.5,
        "target_gbs": 89.9,
        "target_vector_load_bits": 128,
        "vector_load_bits": 128.0,
        "waitcnt_count": null,
        "weight_byte_fraction": 0.9
      },
      "missing_fields": [],
      "next_action": "increase independent tiles/splits or reduce resource pressure",
      "probe_id": "quant_gemv:attn_kv:Q4_K:1024x4096:n54:e0",
      "quant": "Q4_K",
      "reasons": [
        "available concurrency is 0.91x of latency*throughput requirement"
      ],
      "role": "attn_kv",
      "shape": [
        1024,
        4096
      ],
      "visible_bottleneck": "insufficient_residency"
    }
  ],
  "role_count": 7,
  "schema": "boltbeam.analysis_report.v1",
  "selected_routes": [],
  "status": "needs_measurement",
  "timing": {
    "candidate_timing_count": 1,
    "context_count": 1,
    "dominant_timing_bucket": "elementwise_dilution",
    "role_timing_count": 7,
    "status": "classified"
  }
}
